{
  "schema_version": "quickdraw.bdq-long-horizon.v1",
  "task": "R3R",
  "purpose": "Continue the accepted R3Q clean trainer boundary through a bounded update-1000 pilot and, only after that pilot passes, a separate first target-synchronization gate at update 10000.",
  "base_r3o_contract": {
    "path": "Research/trainer/bdq-fifth-update-contract-v1.json",
    "sha256": "35dcd10971878bef31d8e2dd9392599cd71607a009ac6cb8d93bff3857eadcb0",
    "schema_version": "quickdraw.bdq-fifth-update.v1"
  },
  "base_r3q_contract": {
    "path": "Research/trainer/bdq-live-checkpoint-contract-v1.json",
    "sha256": "a5e96d9e40202c1326cee0c6d738cc98ee82dcc76812de823a12a84c1cb5f6f6",
    "schema_version": "quickdraw.bdq-live-checkpoint.v1"
  },
  "base_checkpoint_contract": {
    "path": "Research/trainer/bdq-checkpoint-contract-v1.json",
    "sha256": "071fa03eac09f451bf87455951a634943e77ba6873a3457ca6bf00a4d447c755",
    "schema_version": "quickdraw.bdq-checkpoint.v1"
  },
  "runtime": {
    "python": "3.11.13",
    "mlagents_envs": "1.1.0",
    "numpy": "1.23.5",
    "torch": "2.12.0+cpu",
    "device": "cpu"
  },
  "package": {
    "distribution": "quickdraw-bdq-trainer",
    "version": "0.3.0",
    "metadata_path": "Research/trainer/pyproject.toml",
    "trainer_entry_points": []
  },
  "transport": {
    "api": "mlagents_envs.environment.UnityEnvironment",
    "behavior_name": "QuickDrawResearchBasic",
    "agent_count": 1,
    "observation_shape": [84, 84, 4],
    "observation_layout": "HWC",
    "observation_dtype": "float32",
    "discrete_branches": [3, 2],
    "transition_completion": "complete the pending action when the same agent next appears in DecisionSteps or TerminalSteps",
    "truncation_mask_transport": "quickdraw.basic-truncation-mask.v1",
    "privileged_scene_inference_permitted": false
  },
  "player_execution": {
    "project_settings_path": "ProjectSettings/ProjectSettings.asset",
    "run_in_background": true,
    "source_executable_argument": "--env",
    "copy_complete_player": true,
    "required_siblings": [
      "QuickDrawResearchBasic_Data",
      "UnityPlayer.dll"
    ],
    "no_graphics": false,
    "standalone_player_arguments": [],
    "profiling_output_directory": "worker-output/player-log"
  },
  "continuation_prefix": {
    "source": "accepted R3O trace and R3Q live-derived checkpoint",
    "transition_count": 10016,
    "decision_count": 10016,
    "optimizer_update_count": 5,
    "target_sync_count": 0,
    "accepted_serialized_trace_sha256": "798492f929b27dfbef5b4d3e6f9c886fdd34193f958359e4b6b9de49e535fc2f",
    "accepted_canonical_trace_sha256": "e50182eb2ac6459b835648b3d3eadb7e16f27b33e3c22084de602bfe0c686eca",
    "canonical_transitions_sha256": "3f973d98648255fda4e37637120c3591f14560e958c71cf048a09df506be37ba",
    "online_network_sha256": "8275fed953fb594fea0e88c50da15a862e1db6a3e296dd953dd10e048c2c3cbe",
    "target_network_sha256": "b605debdd6073caa41a95d636bcf20b35d000dc959b06d5cbe585cac0bb433bb",
    "checkpoint_state_sha256": "a899a2e0832623ef933a11e086db1c9036d9e5fc112aab2cd6eccd59b7d9299b",
    "pending_agent_ids": [],
    "post_boundary_action_selected": false
  },
  "epsilon_schedule": {
    "class": "quickdraw_bdq.exploration.LinearEpsilonSchedule",
    "selector_class": "quickdraw_bdq.llapi.ScheduledEpsilonGreedyBDQActionSelector",
    "completed_transition_count_source": "BDQOptimizerController.decision_count",
    "replay_warmup_decisions": 10000,
    "decay_decisions": 100000,
    "initial_epsilon": 1.0,
    "final_epsilon": 0.1,
    "sample_policy": "record completed-transition count 0 and the count immediately before every registered optimizer decision",
    "continuous_selector_rng_from_completed_count_zero": true
  },
  "stages": {
    "pilot": {
      "name": "continuation pilot through optimizer update 1000",
      "order": 1,
      "collection": {
        "scenario_seed": 31001,
        "policy_seed": 51001,
        "exploration_seed": 61001,
        "selector": "seeded_scheduled_branch_epsilon_greedy",
        "epsilon_decay_enabled": true,
        "start_transition_count": 10016,
        "transition_limit": 13996,
        "scheduled_transition_count": 13996,
        "minimum_completed_episodes": 1,
        "minimum_unique_action_tuples": 6,
        "require_no_pending_decision_at_cutoff": true
      },
      "optimization": {
        "replay_capacity": 100000,
        "replay_warmup_decisions": 10000,
        "batch_size": 64,
        "gamma": 0.99,
        "optimizer": "Adam",
        "learning_rate": 0.0001,
        "optimizer_update_interval_decisions": 4,
        "hard_target_sync_interval_optimizer_updates": 10000,
        "expected_first_update_decision": 10000,
        "expected_update_decision_schedule": {
          "first_decision": 10000,
          "interval_decisions": 4,
          "optimizer_update_count": 1000,
          "last_decision": 13996
        },
        "expected_optimizer_updates": 1000,
        "expected_target_synchronizations": 0,
        "expected_target_sync_update_counts": [],
        "require_finite_loss": true,
        "require_finite_mean_absolute_td_error": true,
        "require_online_weights_changed_after_each_update": true,
        "require_target_weights_unchanged": true,
        "record_every_optimizer_update": true,
        "record_epsilon_sample_per_update": true
      },
      "epsilon_schedule": {
        "selection_count": 13996,
        "full_exploration_selection_count": 10001,
        "decay_selection_count": 3995,
        "first_decay_completed_transition_count": 10001,
        "last_selection_completed_transition_count": 13995
      },
      "continuation": {
        "method": "deterministic_replay_of_accepted_prefix_then_trainer_state_continuation",
        "prefix_validation_required": true,
        "prefix_checkpoint_state_required": true,
        "unity_process_resume_claim": false
      },
      "final_clean_boundary": {
        "transition_count": 13996,
        "decision_count": 13996,
        "optimizer_update_count": 1000,
        "target_sync_count": 0,
        "pending_agent_ids": [],
        "post_boundary_action_selected": false,
        "last_selection_completed_transition_count": 13995,
        "target_equals_online": false,
        "target_unchanged_from_prefix": true
      },
      "target_sync_events": [],
      "post_boundary_action_policy": "stop_before_live_action; synthetic_selection_only"
    },
    "synchronization": {
      "name": "first hard target synchronization at optimizer update 10000",
      "order": 2,
      "collection": {
        "scenario_seed": 31001,
        "policy_seed": 51001,
        "exploration_seed": 61001,
        "selector": "seeded_scheduled_branch_epsilon_greedy",
        "epsilon_decay_enabled": true,
        "start_transition_count": 10016,
        "transition_limit": 49996,
        "scheduled_transition_count": 49996,
        "minimum_completed_episodes": 1,
        "minimum_unique_action_tuples": 6,
        "require_no_pending_decision_at_cutoff": true
      },
      "optimization": {
        "replay_capacity": 100000,
        "replay_warmup_decisions": 10000,
        "batch_size": 64,
        "gamma": 0.99,
        "optimizer": "Adam",
        "learning_rate": 0.0001,
        "optimizer_update_interval_decisions": 4,
        "hard_target_sync_interval_optimizer_updates": 10000,
        "expected_first_update_decision": 10000,
        "expected_update_decision_schedule": {
          "first_decision": 10000,
          "interval_decisions": 4,
          "optimizer_update_count": 10000,
          "last_decision": 49996
        },
        "expected_optimizer_updates": 10000,
        "expected_target_synchronizations": 1,
        "expected_target_sync_update_counts": [10000],
        "require_finite_loss": true,
        "require_finite_mean_absolute_td_error": true,
        "require_online_weights_changed_after_each_update": true,
        "require_target_weights_unchanged": false,
        "record_every_optimizer_update": true,
        "record_epsilon_sample_per_update": true
      },
      "epsilon_schedule": {
        "selection_count": 49996,
        "full_exploration_selection_count": 10001,
        "decay_selection_count": 39995,
        "first_decay_completed_transition_count": 10001,
        "last_selection_completed_transition_count": 49995
      },
      "continuation": {
        "method": "deterministic_replay_of_accepted_prefix_then_trainer_state_continuation",
        "prefix_validation_required": true,
        "prefix_checkpoint_state_required": true,
        "unity_process_resume_claim": false
      },
      "final_clean_boundary": {
        "transition_count": 49996,
        "decision_count": 49996,
        "optimizer_update_count": 10000,
        "target_sync_count": 1,
        "pending_agent_ids": [],
        "post_boundary_action_selected": false,
        "last_selection_completed_transition_count": 49995,
        "target_equals_online": true,
        "target_unchanged_from_prefix": false
      },
      "target_sync_events": [
        {
          "decision_count": 49996,
          "optimizer_update_count": 10000,
          "target_sync_count": 1,
          "target_before_sha256": "b605debdd6073caa41a95d636bcf20b35d000dc959b06d5cbe585cac0bb433bb",
          "target_after_equals_online_after": true
        }
      ],
      "post_boundary_action_policy": "stop_before_live_action; synthetic_selection_only"
    }
  },
  "determinism": {
    "fresh_processes": 2,
    "exact_trace_equality": true,
    "torch_num_threads": 1,
    "torch_num_interop_threads": 1,
    "deterministic_algorithms": true,
    "unity_player_required_for_live_collection": true,
    "unity_process_resume_proven": false
  },
  "exclusions": [
    "unrestricted training or convergence claims",
    "optimizer update 10001 or a second target synchronization",
    "post-boundary live action selection",
    "Unity process resume claim",